{
  "name": "create-implementation-plan",
  "version": "1.0.117",
  "description": "Direct implementation and epic plan creation.",
  "author": "jIRI-san",
  "license": "MIT",
  "tags": [
    "skill",
    "planning"
  ],
  "dependencies": [
    "design-review"
  ],
  "status": "stable",
  "files": [
    { "src": "skills/cip/SKILL.md", "dest": "skills/cip/SKILL.md" },
    { "src": "skills/cip/assets/model-aliases.psd1", "dest": "skills/cip/assets/model-aliases.psd1" },
    { "src": "skills/cip/assets/decision-protocol.md", "dest": "skills/cip/assets/decision-protocol.md" },
    { "src": "skills/cip/assets/pre-confirmation-review.md", "dest": "skills/cip/assets/pre-confirmation-review.md" },
    { "src": "skills/cip/assets/plan-template.md", "dest": "skills/cip/assets/plan-template.md" },
    { "src": "skills/cip/scripts/AtomicStore.psm1", "dest": "skills/cip/scripts/AtomicStore.psm1" },
    { "src": "skills/cip/scripts/Get-PlanIndex.ps1", "dest": "skills/cip/scripts/Get-PlanIndex.ps1" },
    { "src": "skills/cip/scripts/New-Plan.ps1", "dest": "skills/cip/scripts/New-Plan.ps1" },
    { "src": "skills/cip/scripts/DirectWorkflow.psm1", "dest": "skills/cip/scripts/DirectWorkflow.psm1" },
    { "src": "skills/cip/scripts/Get-DirectPlanArtifactConsumerContext.ps1", "dest": "skills/cip/scripts/Get-DirectPlanArtifactConsumerContext.ps1" },
    { "src": "skills/cip/scripts/PlanState.psm1", "dest": "skills/cip/scripts/PlanState.psm1" },
    { "src": "skills/cip/scripts/SecretGuard.psm1", "dest": "skills/cip/scripts/SecretGuard.psm1" },
    { "src": "skills/cip/scripts/Set-PlanStage.ps1", "dest": "skills/cip/scripts/Set-PlanStage.ps1" },
    { "src": "skills/cip/scripts/Test-Plan.ps1", "dest": "skills/cip/scripts/Test-Plan.ps1" },
    { "src": "skills/cep/SKILL.md", "dest": "skills/cep/SKILL.md" },
    { "src": "skills/cip/assets/model-aliases.psd1", "dest": "skills/cep/assets/model-aliases.psd1" },
    { "src": "skills/cip/assets/decision-protocol.md", "dest": "skills/cep/assets/decision-protocol.md" },
    { "src": "skills/cip/assets/plan-template.md", "dest": "skills/cep/assets/plan-template.md" },
    { "src": "skills/cep/scripts/Get-PlanIndex.ps1", "dest": "skills/cep/scripts/Get-PlanIndex.ps1" },
    { "src": "skills/cep/scripts/New-Epic.ps1", "dest": "skills/cep/scripts/New-Epic.ps1" },
    { "src": "skills/cep/scripts/AtomicStore.psm1", "dest": "skills/cep/scripts/AtomicStore.psm1" },
    { "src": "skills/cep/scripts/New-Plan.ps1", "dest": "skills/cep/scripts/New-Plan.ps1" },
    { "src": "skills/cep/scripts/DirectWorkflow.psm1", "dest": "skills/cep/scripts/DirectWorkflow.psm1" },
    { "src": "skills/cep/scripts/Get-DirectPlanArtifactConsumerContext.ps1", "dest": "skills/cep/scripts/Get-DirectPlanArtifactConsumerContext.ps1" },
    { "src": "skills/cep/scripts/PlanState.psm1", "dest": "skills/cep/scripts/PlanState.psm1" },
    { "src": "skills/cep/scripts/SecretGuard.psm1", "dest": "skills/cep/scripts/SecretGuard.psm1" },
    { "src": "skills/cep/scripts/Set-PlanStage.ps1", "dest": "skills/cep/scripts/Set-PlanStage.ps1" },
    { "src": "skills/cep/scripts/Test-Plan.ps1", "dest": "skills/cep/scripts/Test-Plan.ps1" }
  ],
  "scaffolds": [
    {
      "path": "docs/implementation-plans/<plan>/**",
      "mode": "parameterized",
      "owner": "New-Plan.ps1",
      "trigger": "plan scaffold (plan.md plus assets/)",
      "confine": "Resolve-ConfinedFolder"
    },
    {
      "path": "docs/implementation-plans/epics/<epic>/**",
      "mode": "parameterized",
      "owner": "New-Epic.ps1",
      "trigger": "epic scaffold",
      "confine": "Resolve-ConfinedFolder"
    }
  ],
  "evals": {
    "path": "evals/",
    "status": "none",
    "lastRun": null
  }
}
