{
  "name": "architecture-notes",
  "version": "1.0.12",
  "description": "Architecture notes toolkit — skill-first authoring of interface-level architectural contracts and ADRs, with a parallel docs/architecture-notes tier. /can and /uan are thin prompt wrappers over the skill.",
  "author": "jIRI-san",
  "license": "MIT",
  "tags": [
    "skill",
    "prompt",
    "architecture",
    "architecture-notes"
  ],
  "dependencies": [],
  "status": "partial",
  "files": [
    {
      "src": "skills/architecture-notes/SKILL.md",
      "dest": "skills/architecture-notes/SKILL.md"
    },
    {
      "src": "skills/architecture-notes/assets/templates/architecture-notes-index.template.md",
      "dest": "skills/architecture-notes/assets/templates/architecture-notes-index.template.md"
    },
    {
      "src": "skills/architecture-notes/assets/templates/architecture-note.template.md",
      "dest": "skills/architecture-notes/assets/templates/architecture-note.template.md"
    },
    {
      "src": "scripts/Copy-ArchScaffold.ps1",
      "dest": "skills/architecture-notes/scripts/Copy-ArchScaffold.ps1"
    },
    {
      "src": "scripts/Test-ArchContract.ps1",
      "dest": "skills/architecture-notes/scripts/Test-ArchContract.ps1"
    },
    {
      "src": "scripts/Get-ArchContractContentHash.ps1",
      "dest": "skills/architecture-notes/scripts/Get-ArchContractContentHash.ps1"
    },
    {
      "src": "scripts/New-ArchSeed.ps1",
      "dest": "skills/architecture-notes/scripts/New-ArchSeed.ps1"
    },
    {
      "src": "scripts/Import-ArchAdr.ps1",
      "dest": "skills/architecture-notes/scripts/Import-ArchAdr.ps1"
    },
    {
      "src": "skills/architecture-notes/assets/interview-guide.md",
      "dest": "skills/architecture-notes/assets/interview-guide.md"
    },
    {
      "src": "skills/architecture-notes/assets/tier-operations-guide.md",
      "dest": "skills/architecture-notes/assets/tier-operations-guide.md"
    },
    {
      "src": "skills/architecture-notes/assets/adr-template.md",
      "dest": "skills/architecture-notes/assets/adr-template.md"
    },
    {
      "src": "prompts/can.prompt.md",
      "dest": "prompts/can.prompt.md"
    },
    {
      "src": "prompts/uan.prompt.md",
      "dest": "prompts/uan.prompt.md"
    }
  ],
  "scaffolds": [
    {
      "path": "docs/architecture-notes/.architecture-notes.md",
      "mode": "literal",
      "owner": "Copy-ArchScaffold.ps1",
      "trigger": "tier scaffold on first run"
    },
    {
      "path": "docs/architecture-notes/.staging",
      "mode": "literal",
      "owner": "Import-ArchAdr.ps1",
      "trigger": "ADR staging"
    },
    {
      "path": "docs/architecture-notes/.staging/adr",
      "mode": "literal",
      "owner": "Import-ArchAdr.ps1",
      "trigger": "ADR harvest at plan finalization"
    },
    {
      "path": "docs/architecture-notes/.staging/ADR-HARVEST.md",
      "mode": "literal",
      "owner": "Import-ArchAdr.ps1",
      "trigger": "ADR harvest at plan finalization"
    }
  ],
  "evals": {
    "path": "evals/",
    "status": "none",
    "lastRun": null
  }
}
