{
  "name": "factory-loop",
  "version": "0.1.10",
  "description": "Run a restartable, issue-driven delivery loop with local demo adapters and explicit human gates.",
  "author": "jIRI-san",
  "license": "MIT",
  "tags": [
    "automation",
    "delivery",
    "skill"
  ],
  "dependencies": [],
  "status": "partial",
  "files": [
    {
      "src": "skills/factory-loop/SKILL.md",
      "dest": "skills/factory-loop/SKILL.md"
    },
    {
      "src": "skills/factory-loop/assets/operator-guide.md",
      "dest": "skills/factory-loop/assets/operator-guide.md"
    },
    {
      "src": "skills/factory-loop/assets/acceptance-authoring.md",
      "dest": "skills/factory-loop/assets/acceptance-authoring.md"
    },
    {
      "src": "skills/factory-loop/scripts/FactoryLoop.psm1",
      "dest": "skills/factory-loop/scripts/FactoryLoop.psm1"
    },
    {
      "src": "skills/factory-loop/scripts/Setup-FactoryLoop.ps1",
      "dest": "skills/factory-loop/scripts/Setup-FactoryLoop.ps1"
    },
    {
      "src": "skills/factory-loop/scripts/Invoke-FactoryLoopAdapter.ps1",
      "dest": "skills/factory-loop/scripts/Invoke-FactoryLoopAdapter.ps1"
    },
    {
      "src": "skills/factory-loop/scripts/FactoryLoop.Runtime.psm1",
      "dest": "skills/factory-loop/scripts/FactoryLoop.Runtime.psm1"
    },
    {
      "src": "skills/factory-loop/scripts/Start-FactoryLoopChain.ps1",
      "dest": "skills/factory-loop/scripts/Start-FactoryLoopChain.ps1"
    },
    {
      "src": "skills/factory-loop/scripts/Invoke-FactoryLoopTick.ps1",
      "dest": "skills/factory-loop/scripts/Invoke-FactoryLoopTick.ps1"
    },
    {
      "src": "skills/factory-loop/scripts/Register-FactoryLoopRepairPullRequest.ps1",
      "dest": "skills/factory-loop/scripts/Register-FactoryLoopRepairPullRequest.ps1"
    },
    {
      "src": "skills/ci/scripts/DirectWorkflow.psm1",
      "dest": "skills/factory-loop/dependencies/ci/scripts/DirectWorkflow.psm1"
    },
    {
      "src": "skills/ci/scripts/PlanState.psm1",
      "dest": "skills/factory-loop/dependencies/ci/scripts/PlanState.psm1"
    },
    {
      "src": "skills/ci/scripts/SecretGuard.psm1",
      "dest": "skills/factory-loop/dependencies/ci/scripts/SecretGuard.psm1"
    },
    {
      "src": "skills/factory-loop/scripts/New-FactoryLoopDemo.ps1",
      "dest": "skills/factory-loop/scripts/New-FactoryLoopDemo.ps1"
    },
    {
      "src": "skills/factory-loop/templates/factory-loop.json",
      "dest": "skills/factory-loop/templates/factory-loop.json"
    },
    {
      "src": "skills/factory-loop/templates/FactoryLoop.Adapter.ps1",
      "dest": "skills/factory-loop/templates/FactoryLoop.Adapter.ps1"
    },
    {
      "src": "skills/factory-loop/templates/demo/Invoke-Acceptance.ps1",
      "dest": "skills/factory-loop/templates/demo/Invoke-Acceptance.ps1"
    },
    {
      "src": "skills/factory-loop/templates/demo/Invoke-DemoApp.ps1",
      "dest": "skills/factory-loop/templates/demo/Invoke-DemoApp.ps1"
    }
  ],
  "scaffolds": [
    {
      "path": ".factory-loop/**",
      "mode": "parameterized",
      "owner": "Setup-FactoryLoop.ps1",
      "trigger": "explicit setup of a selected consumer",
      "confine": "Resolve-FactoryLoopConsumerPath"
    },
    {
      "path": "scripts/factory-loop/**",
      "mode": "parameterized",
      "owner": "Setup-FactoryLoop.ps1",
      "trigger": "explicit setup of a selected consumer",
      "confine": "Resolve-FactoryLoopConsumerPath"
    },
    {
      "path": ".github/skills/ci/scripts/**",
      "mode": "parameterized",
      "owner": "Setup-FactoryLoop.ps1",
      "trigger": "explicit setup of a selected consumer",
      "confine": "Resolve-FactoryLoopConsumerPath"
    },
    {
      "path": "docs/factory-loop/evidence/**",
      "mode": "parameterized",
      "owner": "FactoryLoop.Runtime.psm1",
      "trigger": "explicit sanitized evidence publication",
      "confine": "Resolve-FactoryLoopConsumerPath"
    }
  ],
  "evals": {
    "path": "evals/",
    "status": "none",
    "lastRun": null
  }
}
