{
  "name": "code-review",
  "version": "1.0.89",
  "description": "Risk-selected code review with direct advisory Markdown.",
  "author": "jIRI-san",
  "license": "MIT",
  "tags": [
    "review",
    "agent",
    "prompt"
  ],
  "dependencies": [],
  "status": "stable",
  "files": [
    { "src": "prompts/cr.prompt.md", "dest": "prompts/cr.prompt.md" },
    { "src": "skills/cr/SKILL.md", "dest": "skills/cr/SKILL.md" },
    { "src": "skills/cr/assets/model-aliases.psd1", "dest": "skills/cr/assets/model-aliases.psd1" },
    { "src": "skills/cr/scripts/Get-DirectPlanArtifactConsumerContext.ps1", "dest": "skills/cr/scripts/Get-DirectPlanArtifactConsumerContext.ps1" },
    { "src": "skills/cr/scripts/DirectWorkflow.psm1", "dest": "skills/cr/scripts/DirectWorkflow.psm1" },
    { "src": "skills/cr/scripts/PlanState.psm1", "dest": "skills/cr/scripts/PlanState.psm1" },
    { "src": "skills/cr/scripts/SecretGuard.psm1", "dest": "skills/cr/scripts/SecretGuard.psm1" },
    { "src": "agents/cr.agent.md", "dest": "agents/cr.agent.md" },
    { "src": "agents/scripts/Get-ReviewScope.ps1", "dest": "agents/scripts/Get-ReviewScope.ps1" }
  ],
  "evals": {
    "path": "evals/",
    "status": "none",
    "lastRun": null
  }
}
