{
  "name": "self-improvement",
  "version": "1.0.85",
  "description": "Stateless post-plan feedback and bounded local self-improvement from the recent-learning handoff.",
  "author": "jIRI-san",
  "license": "MIT",
  "tags": [
    "skill",
    "prompt",
    "feedback",
    "self-improvement"
  ],
  "dependencies": [
    "create-implementation-plan"
  ],
  "status": "stable",
  "files": [
    {
      "src": "prompts/pfb.prompt.md",
      "dest": "prompts/pfb.prompt.md"
    },
    {
      "src": "skills/pfb/SKILL.md",
      "dest": "skills/pfb/SKILL.md"
    },
    {
      "src": "skills/pfb/assets/feedback-guide.md",
      "dest": "skills/pfb/assets/feedback-guide.md"
    },
    {
      "src": "skills/pfb/scripts/PlanState.psm1",
      "dest": "skills/pfb/scripts/PlanState.psm1"
    },
    {
      "src": "prompts/si.prompt.md",
      "dest": "prompts/si.prompt.md"
    },
    {
      "src": "skills/si/SKILL.md",
      "dest": "skills/si/SKILL.md"
    },
    {
      "src": "skills/si/assets/harvest-guide.md",
      "dest": "skills/si/assets/harvest-guide.md"
    },
    {
      "src": "skills/si/assets/propose-guide.md",
      "dest": "skills/si/assets/propose-guide.md"
    },
    {
      "src": "skills/si/scripts/PlanState.psm1",
      "dest": "skills/si/scripts/PlanState.psm1"
    },
    {
      "src": "skills/si/scripts/Test-SiWriteScope.ps1",
      "dest": "skills/si/scripts/Test-SiWriteScope.ps1"
    },
    {
      "src": "scripts/Get-SiHarvest.ps1",
      "dest": "skills/si/scripts/Get-SiHarvest.ps1"
    },
    {
      "src": "scripts/SecretGuard.psm1",
      "dest": "skills/si/scripts/SecretGuard.psm1"
    }
  ],
  "evals": {
    "path": "evals/",
    "status": "none",
    "lastRun": null
  }
}
