{
  "name": "design-review",
  "version": "1.0.91",
  "description": "Risk-selected design review with direct advisory Markdown.",
  "author": "jIRI-san",
  "license": "MIT",
  "tags": [
    "design-review",
    "agent",
    "prompt"
  ],
  "dependencies": [],
  "status": "stable",
  "files": [
    { "src": "prompts/dr.prompt.md", "dest": "prompts/dr.prompt.md" },
    { "src": "skills/dr/SKILL.md", "dest": "skills/dr/SKILL.md" },
    { "src": "skills/dr/assets/model-aliases.psd1", "dest": "skills/dr/assets/model-aliases.psd1" },
    { "src": "skills/dr/scripts/Get-DirectPlanArtifactConsumerContext.ps1", "dest": "skills/dr/scripts/Get-DirectPlanArtifactConsumerContext.ps1" },
    { "src": "skills/dr/scripts/DirectWorkflow.psm1", "dest": "skills/dr/scripts/DirectWorkflow.psm1" },
    { "src": "skills/dr/scripts/PlanState.psm1", "dest": "skills/dr/scripts/PlanState.psm1" },
    { "src": "skills/dr/scripts/SecretGuard.psm1", "dest": "skills/dr/scripts/SecretGuard.psm1" },
    { "src": "agents/dr.agent.md", "dest": "agents/dr.agent.md" }
  ],
  "evals": {
    "path": "evals/",
    "status": "none",
    "lastRun": null
  }
}
